keyword,sentances
Solitude,Was he really condemned to an eternal solitude because of the girl who had died so many years ago?
Solitude,"Prud'hon, in humiliation and despair, lived in a solitude almost complete."
Solitude,"He walked on, and thought of the rapt liberty of the soul in the sweet serenities of beautiful solitude."
Solitude,"No, poor thing, I fear she has anxieties of her own just now, she seeks solitude a good deal."
Solitude,"Then he would burst rudely into my solitude and while I sopped cold water over his injured members, he would blubber."
Sonorous,"There was Radim Palouš, the sonorous philosophical godfather of Kampademia."
Sonorous,"At the end, the sonorous Welles concludes with a little talk about Halloween."
Sonorous,"Franklin Roosevelt's addresses in 1933 and 1937 remain alive, as does the sonorous rhetoric of John F. Kennedy's address in 1961."
Sonorous,"The ancient cities, the dreamy harbors, the sonorous street names that no longer existed."
Sonorous,"In my youth, you heard, side-by-side, the church bells ringing and the beautiful, sonorous call to prayer of the muezzin."
Sonorous,"Her glance wandered from his face away toward the Gulf, whose sonorous murmur reached her like a loving but imperative entreaty."
Sonorous,"Pausing at the threshold before opening the door, the sonorous mumble sounding through the deal panels misled me."
Sonorous,Jerry hit the instrument as he spoke and drowned his own voice in its sonorous roar.
Sonorous,"Over me, away off, as if from the heavens, I heard a sonorous rumble of mystery words."
Sonorous,"I should think 'twould make a splendid subject—you could use such sonorous, resounding words."
Sumptuous,"Lunch finally arrives, this time not a sumptuous feast but fish wrapped in a military newspaper distributed on U.S. bases."
Sumptuous,The table was set with the Cavendish silver and crystal and various sumptuous-looking bottles from the wine cellar.
Sumptuous,"“sumptuous,” Huston continued, pointing out the image of a richly crimson carriage interior."
Sumptuous,Apple has long been known for luring the best talent the tech world can offer to its sumptuous Cupertino headquarters.
Sumptuous,"People like sumptuous things, and will pay to have them, especially when the copies lack the look and feel of the original."
Sumptuous,The startled guests filed hastily across to find a dainty but sumptuous repast served at little tables.
Sumptuous,"In the sumptuous dining-room, their elbows on the table, full of meat and drink, they planned and discussed."
Sumptuous,And the baroness threw a furtive look on the ancient and sumptuous clock in a corner of the room.
Sumptuous,"The autumn was unusually fine, and the colours sumptuous beyond description."
Sumptuous,"Far up against Dalgrothe Mountain appeared a sumptuous star, mystical and red."
Surreptitious,Last month I turned and faced their surreptitious security: “Catch any thieves today?”
Surreptitious,Stephanie often takes surreptitious photographs of fellow commuters for a not-yet-realized blog.
Surreptitious,They refused until they had “achieved their surreptitious climax.”
Surreptitious,"But by 1953, with McCarthyism and the second Red Scare in full swing, the FBI moved from surreptitious research to direct contact."
Surreptitious,Grandmother Penny and Mr. Spackles went to the circus in a more or less surreptitious manner.
Surreptitious,"The house was but a small one, with no surreptitious closets or cupboards, or other hiding-places."
Surreptitious,She took a surreptitious glance at the profile of Captain Goritz.
Surreptitious,"It was his first surreptitious taste of fame on the Atlantic coast, and not without its delight."
Surreptitious,She reflected quickly that he could not have known anything of her surreptitious trading with the peddler.
Tranquility,"But relative to centuries past, America is a marvel of domestic tranquility."
Tranquility,But the illusions of peace and tranquility soon crumble around them like a patch of freshly laid snow.
Tranquility,"The waiting room is ill-kempt, but inside its institutional blue and white walls, there is a surprising sense of tranquility."
Tranquility,"“It gives me tranquility,” said Batya Katzir, another Ashdod resident."
Tranquility,"So it was something that would symbolize some tranquility, peace—anything that would give it a good energy."
Tranquility,In your last letter you ask whether your remaining at Bath is necessary to my tranquility.
Tranquility,"The public tranquility had not been disturbed, when armed peasants introduced themselves."
Tranquility,Who was this mysterious correspondent that dared to disturb the tranquility of his retreat?
Tranquility,"He did so with the greatest tranquility, as if the objection was the most insignificant affair in the world."
Tranquility,"I am obliged to write in haste, and very imperfectly, a work which requires the leisure and tranquility I do not enjoy."
Umbrella,And that means they also fall under the umbrella of programs most likely to get the axe when state and federal budgets are tight.
Umbrella,"The program—weirdly—is now under the umbrella of ABC News, and is suffering from flat ratings and an aging demographic."
Umbrella,"The law professor, Benny Tai, urged the students to “retreat and take the spirit of the umbrella Movement into the community.”"
Umbrella,Think of them as the Monuments Men and Women of the umbrella Movement.
Umbrella,"From Carnations to umbrella, the history and importance of names people give to nonviolent movements."
Umbrella,"She looked up in his face, leaning on his arm beneath the encircling shadow of the umbrella which he had lifted."
Umbrella,"Now that it rains there's no more room under your umbrella than there was a few moments ago, when the sun was shining."
Umbrella,As he spoke he wedged himself between Grandfather Mole and the stem of the toadstool umbrella.
Umbrella,"""It's plain that your umbrella didn't grow as much as you thought,"" Mr. Meadow Mouse retorted."
Umbrella,"He put on his big straw hat, and taking his umbrella from the stand in the hall, followed the lady in black, never overtaking her."
Wanderlust,These are seriously fun journeys that allow users to satisfy their wanderlust without a plane ticket.
Wanderlust,"wanderlust stresses a no-harm-done mantra, and their intention is not, as Austin puts it, “to poke holes in the security theater.”"
Wanderlust,"With the watch, wanderlust found a way to cover costs and ensure a varied and trustworthy clientele."
Wanderlust,The Night Heron was the first adventure wanderlust opened up to an audience larger than a pre-set guest list.
Wanderlust,The wanderlust Projects duo are building bars in water towers and romantic getaways in abandoned resorts.
Wanderlust,"Easy as life was for Gorky in this city, where he remained for a while, the ""wanderlust"" again seized him."
Wanderlust,He was a boyish and attractive individual whom the wanderlust had driven westward from his home in Wisconsin.
Wanderlust,"The wanderlust becomes chronic, and mainly because it was not treated properly in its intermittent stage."
Wanderlust,The sweet fragrance of blossoming orchards tingled in your nostrils and thrilled you with wanderlust.
Wanderlust,Moonlight nights had come and the wanderlust was growing more and more insistent in his veins.
Wherewithal,"Somebody maybe doesn't have the wherewithal to get out, the means to get out—I had that."
Wherewithal,"I lack the wherewithal to start my own competing certifying board, to say nothing of the chutzpah."
Wherewithal,Those who have the wherewithal to shop online with greater ease and frequency have a greater ability to avoid sales taxes.
Wherewithal,The British middle class no longer had servants--but they also lacked the wherewithal to obtain fancy new appliances.
Wherewithal,"“Even if you had the wherewithal to embarrass a reporter, there was no mechanism to do it,” Mr. Cramer said."
Wherewithal,"But a lawyer who needed the wherewithal finally condescended to risk the task, and into it he plunged."
Wherewithal,"Secondly, we had already been for some time at work to fix up the wherewithal to meet our chronic nightmare, the water trouble."
Wherewithal,And how do you know that I have got wherewithal to pay the reckoning?
Wherewithal,"If they have wherewithal to persuade the Jury to bring it in Manslaughter, what are they the worse for it?"
Wherewithal,He immediately clamored for the wherewithal to fill an aching void that was making itself painfully felt in his midsection.
Wistfulness,"But the words “responsible” and “Republican” are no longer typeable together except in moods of mockery, or at least wistfulness."
Wistfulness,That gave last night's dinner with Ahmadinejad an air of wistfulness tinged with growing fear.
Wistfulness,"Winston smiled, though there was a wistfulness in his eyes as he saw the faint bewilderment in his companions' faces."
Wistfulness,"For at least five minutes he stood without moving, his whole face softened into a boyish wistfulness."
Wistfulness,"She rose at this, turning her eyes about the room as if from the extremity of martyrdom or the wistfulness of some deep thought."
Wistfulness,"She always suggested tea before the hour, and her friend always, but with so different a wistfulness, rang for it."
Wistfulness,I was awake at once––wide awake for him: moved by the wistfulness of this appeal to some perception of his need.
Zenith,"Who was the most erotic poet of the late Renaissance and early Baroque, when the quatrain reached its courtly zenith?"
Zenith,This reached its zenith when he and Jon Stewart held their Rally to Restore Sanity And/Or Fear in 2010.
Zenith,"In his own mind he is at the zenith of his life, a man in full."
Zenith,The major labor unions - then at the zenith of their political power - disliked Johnson.
Zenith,"In 1986, at the zenith of her strength, that figure was reduced to 1.9 million."
Zenith,"The sky was alight from zenith to horizon, the Nile aflame with sunrise, by the time the letter was written."
Zenith,"The leathered Diapason, indeed, is now attaining a zenith of popularity both in England and America."
Zenith,Coloured shafts mapped the vault from horizon to zenith like the spokes of a prodigious wheel of fire.
Zenith,"The sun, a ball of fiery brass, burned directly in the zenith, so that the shadow of the foliage lay like a carpet about her feet."
Zenith,How did it fare with the poor all over Europe in the centuries when Christianity was at the zenith of its power?
