keyword,sentances
Lullaby,"Twas a quiet sea, breaking, in crooning lullaby, upon the rocks below my bedroom window."
Lullaby,"The night winds sing her lullaby, and little children hear the music of her voice and look into her answering eyes."
Lullaby,"She gave the gun to Polly, and told her to walk up and down the porch with it and sing a lullaby."
Luminescence,"Tim said to me, “What if someone took a picture on their iPad and then used this method to turn iPad luminescence into oil paint?”"
Luminescence,"And, ironically, in the darkness, he sees the luminescence of the jungle around him."
Luminescence,"It glowed in the room with a pearly luminescence, and she saw the man's eyes turning to it, drawn as if by magic."
Luminescence,The luminescence died; there was no longer light enough to penetrate to his helmet's darkened goggles.
Luminescence,"His left hand fell upon Assha's shoulder, turning the man half around as Ross, too, stepped upon the patch of luminescence."
Luminescence,"Then, swiftly as it had come, it was gone, and only a small globe of white luminescence floated above the great hulking machine."
Luminescence,"Hungrily the Earth man stared at his distant flash pistols, plainly visible in the luminescence of their fungus bedding."
Lyrical,"From a lyrical standpoint, there are precious few that can catch Kendrick."
Lyrical,I promised never again to wax lyrical about the fries in gravy.
Lyrical,"He loved simplicity in his musical arrangements, which allowed his lyrical message and melodies to shine through."
Lyrical,The lyrical declamation has inspired luminaries ranging from Kurt Vonnegut to Robert Frost.
Lyrical,This dad read it as the latter and wrote his own lyrical rebuttal to the tune.
Lyrical,"True hymns are sacred lyrics, and a lyric to be lyrical and heart appealing, must be inevitable."
Lyrical,"But what of the love, however expressed, in the lyrical invocation to the brown liqueur?"
Lyrical,Who shall sing in lyrical language the exhilaration of such splendid men's work?
Lyrical,"Still, Andronicus was the first to substitute the Greek drama for the old lyrical stage poetry."
Lyrical,"In lyrical poetry, the Romans can boast of one of the greatest masters of any age or nation."
Melancholy,"I found their melancholy inviting and I appreciated their contemplative, lonely world."
Melancholy,"In the first chapter, rebellious Holly Sykes runs away from home and headlong into the melancholy perils of first love."
Melancholy,"""Ah, that trip with Lance,"" he said, then glanced down, with those melancholy eyes."
Melancholy,The slurring of relationships and transactions has effects ranging from the gruesome to the melancholy.
Melancholy,"Young and gracious faces, somewhat remote and proud, but with a melancholy and sweet kindness."
Melancholy,"But, when the car came thundering down, it was crammed to the step; with a melancholy gesture, the driver declined her signal."
Melancholy,"At the same time he is appreciative and very amusing, and one has no chance to indulge in melancholy with him."
Melancholy,"Quaint old Burton in his ""Anatomy of melancholy,"" recognizes the virtues of the plant while he anathematizes its abuse."
Melancholy,There is among women always a melancholy satisfaction in seeing the very last of the beloved object.
Melancholy,There is nothing like it among us at the present day except within the melancholy precincts of the penitentiary.
Mellifluous,"In or out of uniform his motion is languid, his voice relaxed and mellifluous, his movements deliberate, confident."
Mellifluous,"And Costas is, after all, a guy who is famous for his mellifluous commentary on balls and strikes, touchdowns and field goals."
Mellifluous,By the time she had taken in so much as this the mellifluous young man had perceived and addressed himself to her brother.
Mellifluous,And the banks of those rivers resounded with the mellifluous strains of the male Kokilas and the notes of peacocks and cranes.
Mellifluous,"One is not surprised at their being addressed by such mellifluous epithets as Cushla machree, asthore, mavourneen!"
Mellifluous,"No, no; change churlish dreams and braving trumpets to mellifluous flutes."
Mellifluous,"Though she had spoken quite sharply at the telephone, her voice was mellifluous when she attuned it to Gabriella."
Miraculous,But a funny thing happened on the way to the funeral: a miraculous resurrection!
Miraculous,"A volunteer I spoke to at length, Julia Cohen, explained to me that the miraculous power of Amma is her intuitiveness."
Miraculous,The miraculous brand of Billy-the-Fish football is almost over and the butch giants are back.
Miraculous,"While no one doubts that Diaz is healed, surviving brain aneurysms is not exactly miraculous."
Miraculous,Inside her miraculous recovery and her fight against returning to Afghanistan.
Miraculous,"To Indians that appears a miraculous thing, beyond what is either acquired or natural."
Miraculous,"Hilda, once more and in a higher degree, realized the miraculous human power to make experience out of nothing."
Miraculous,"The fact alleged, then, is miraculous and important, and the evidence in proof of such a fact should be overwhelmingly strong."
Miraculous,"Joan was calmer now, and her mother had put on some warmer, and less miraculous, garments."
Miraculous,"Miss Anne went on to talk of Jean, a miraculous infant of infinite graces and accomplishments."
Nefarious,"Sometimes politicians oppose reform for nefarious reasons—to protect a special interest or a major donor, for example."
Nefarious,"The Arabs offered the Nazis a haven, as well as a market for all their nefarious dealings in arms and black market currency."
Nefarious,Rumors swirled that the McStays had gone into Mexico and were involved in nefarious dealings with drug cartels.
Nefarious,"But Green-Wood is more famous for its nefarious residents, those of the drug-peddling, political-swindling, hit-men variety."
Nefarious,Greece claims they were looted from the Parthenon by a nefarious British Indiana Jones character in the early 1800s.
Nefarious,"Some were even re-arrested for the same nefarious purpose, and the daily papers published their names on each occasion."
Nefarious,"There, if his eyes did not deceive him, were evidences of mortar dislodged by nefarious toes."
Nefarious,"She was to join him a week later, after he had had time to spy out the land and make his nefarious schemes for a mock marriage."
Nefarious,"It wasn't built by Green, but by a former owner of the farm, who was in the same nefarious business."
Nefarious,"This is, then, what Bond artifice effected in the absence of actual cause and in order to dissimulate its own nefarious objects."
Nemesis,"He finally died in a drawn-out battle with his Irish mobster nemesis, John Morrissey."
Nemesis,The Third Reich met its nemesis as much here as it had—albeit in far greater numbers—at Stalingrad.
Nemesis,Neither her name nor her nemesis are among the slurred words I can make out.
Nemesis,The nemesis that emerges most potently is that of reality TV.
Nemesis,The site is provocative enough in the vegan world to earn its own digital arch-nemesis “30 Bananas A Day…Sucks!”
Nemesis,We have swift reward and punishment—no hateful things called nemesis.
Nemesis,"Then, as though grown weary of the idyllic romance she was composing, Fortune donned the tragic robes of nemesis."
Nemesis,"What was the tragic destiny that hung over them—the nemesis that gripped them, and forced them to take such a chance?"
Nemesis,"When off the island of Moora the nemesis came suddenly upon a fleet of eleven pirate boats, pursuing a trading prahu."
Nemesis,"The nemesis chased the pirates to the shore, who drew up in line along the beach."
Oblivion,"If opponents of gay rights are supposed to be retreating into oblivion, they missed the memo."
Oblivion,The team could sink into oblivion—or be bought by a beloved figure who could transform it.
Oblivion,"That which gave him the power over me came back out of oblivion, where I had hoped to keep it."
Oblivion,"Instead, one is headed to political oblivion, and the other is staring it in its face."
Oblivion,"Not even a plan: just a wild lashing out, really, against oblivion."
Oblivion,"He was contemporary with Milton, and preferred before him by critics of the day, but has now sunk into oblivion."
Oblivion,"Could you have let them alone, by this time, poor Souls, they had been all peaceably buried in oblivion!"
Oblivion,"After the total oblivion of the matter in his waking moments, he will sometimes recall all the details of the affair in a dream."
Oblivion,"Sleep kindly came to some, and lulled their spirits into momentary oblivion."
Oblivion,"Holding the violin aloft, he cried exultingly: Henceforth thou art mine, though death and oblivion lurk ever near thee!"
Onomatopoeia,He seemed as much taken aback as if he had found a tribe of Cherokees studying onomatopoeia in English verse.
Onomatopoeia,All words which were spontaneously acquired seemed to be instances of onomatopoeia.
Onomatopoeia,"onomatopoeia, formations of words resembling in sound that of the things denoted by them."
Onomatopoeia,"Mao, the term for a ""cat,"" is obviously an example of onomatopoeia."
Onomatopoeia,This correspondence of sound and sense is called onomatopoeia.
Opulence,"We see it at several different periods, from the height of its opulence in the 1930s to the shabby Communist look of the 1960s."
Opulence,"The scale, opulence and fantasy so prevalent a few miles away on the Strip is nowhere to be found."
Opulence,"Many say that The Great Beauty is the new Fellini, with its handsome surrealism, baroque expressions, and casual opulence."
Opulence,"The Daily Pic: The Met's Cloisters branch turns 75, and shows off knightly opulence."
Opulence,"The opulence of the gifts is legendary, and it used to be that the presenters and performers at the ceremony also received them."
Opulence,"There were hundreds of thousands in France, the most illustrious in rank and opulence, who would join such an army."
Opulence,"opulence introduced the cultivation of the fine arts, with a taste for literature, and consequently for disputation."
Opulence,There are beings so dejected—so penurious—that this swearing constitutes their whole store of worldly opulence.
Opulence,The emigrant from the sandbanks of Cape Cod revels in the profusion of the opulence of Ohio.
Opulence,"Hundreds of families were burned out, and reduced from opulence, or at least competency, to penury."
Paradox,"But I feel like films are uniquely suited towards addressing paradox, recursiveness, and worlds-within-worlds."
Paradox,"To appreciate the Palmer paradox, it's important to understand that Palmer's childhood and young adulthood were dichotomous."
Paradox,"“Maybe we need a new category other than theism, atheism or agnosticism that takes paradox and unknowing into account,” he writes."
Paradox,But Washington was a prisoner to its paradox of an Iraq policy.
Paradox,"As a result of this paradox, the Iraq policy process ground to a halt at the very moment that ISIS was on the rise."
Paradox,"It offers, to those who see it aright, the most perplexing industrial paradox ever presented in the history of mankind."
Paradox,But in reality this paradox of value is the most fundamental proposition in economic science.
Paradox,"It was the spiritual way, whose method and secret lie in that subtle paradox: Yield to conquer."
Paradox,"But it was a strange paradox, that precisely the depth of his love for her made him willing to think of losing her."
Paradox,But this very paradox leads to the real principle of generalization concerning the properties of numbers.
Peace,"Domestically, the prime minister maintains the dubious line that he is the only man who can keep the still-fragile peace."
Peace,"They called for peace, reconciliation, and the safe return of Father Gregorio."
Peace,The question is will we see regime changes in both Hamas and Israel that embrace a lasting peace?
Peace,"But without any peace talks on the horizon, everyone is now left to their own devices."
Peace,"At Christianity Today, Peter Chin claims Christians should preach peace instead of bogging down in the particulars of race."
Peace,"My son,” said Grabantak one evening to Chingatok, “if we are henceforth to live in peace, why not unite and become one nation?"
Peace,"Impressed by the lugubrious scene, Aguinaldo yielded, and the next day peace negotiations were opened."
Peace,"Above all, he was amazed to hear me talk of a mercenary standing army in the midst of peace and among a free people."
Peace,"And it was no light task, then, for six hundred men to keep the peace on a thousand miles of frontier."
Peace,"O death, how bitter is the remembrance of thee to a man that hath peace in his possessions!"
Picturesque,"Chefchaouen, shut off from the world for centuries, is almost absurdly picturesque."
Picturesque,"One Street Museum is dedicated to the picturesque old Kiev street called Andriyivskyy Descent, on which it is situated."
Picturesque,"Later, we hiked up a picturesque trail to the Dovbush rocks, which are a sort of local Stonehenge."
Picturesque,But the area is also an unexplored region of picturesque villages and surprising flavors.
Picturesque,His social snapshots reveal the unhappy repercussions of tyranny and poverty in a picturesque Africa.
Picturesque,"Many adults assume that a child can look at a landscape as they look at it, taking in the whole picturesque effect."
Picturesque,"It was a large, beautiful room, rich and picturesque in the soft, dim light which the maid had turned low."
Picturesque,It is true that they wanted the picturesque splendour of ancient warfare.
Picturesque,"There is nothing picturesque in those old towns, for they were dead before they were civilized."
Picturesque,"It lies in a large and picturesque hollow, surrounded by mountains at an elevation of 3,200 feet above the level of the sea."
Plethora,There should be a plethora of four-letter words flying around the Veep set this morning.
Plethora,"Where there was a plethora of strong women, instead of just, like, Kristen Wiig doing every sketch each week."
Plethora,"Like the best pop stars, Swift has borrowed from a plethora of genres and influences."
Plethora,"Within hours of the pictures ending up online, a plethora of articles were written."
Plethora,"During the mid-to-late 1980s, he went on an absolute tear, helming a plethora of irresistible entertainments."
Plethora,"Tressan was monstrous ill-at-ease, and his face lost a good deal of its habitual plethora of colour."
Plethora,"The army of Spain would seem to suffer from a plethora of officers, especially those of the highest rank."
Plethora,"And, even in such a plethora of massacres, it is strange they should have suffered such neglect."
Plethora,"Justinian, it may be noted, had equipped this army with such a plethora of commanders that their defeat can hardly cause surprise."
Plethora,"Gold, in the midst of its sudden plethora, was a perplexing problem to the financial prophets of a third of a century ago."
Pristine,The grand prize is a pristine white Fiat Panda 4X4 – with full options.
Pristine,Today the Stanley is in pristine shape after another series of renovations were completed in 2013.
Pristine,There are still places in the sea as pristine as I knew as a child.
Pristine,"There are always examples of degradation, but there are very few examples of ecosystems left that are that pristine."
Pristine,"Beauty is often pristine, Harding says, while the word “gorgeous” contains more the idea of extremes and can include decay."
Pristine,"We have native hearts and virtues, just as other nations; which in their pristine purity are noble, potent, and worthy of example."
Pristine,Medicine and religion have been closely associated from the most pristine time.
Pristine,"Then agriculture will be ""restored to right uses"" and held in its pristine honor; and the earth will yield its fruits abundantly."
Pristine,"It was of course the shadow of the Midas statue, which the boys had never permitted to be restored to its pristine state."
Pristine,But it is far from being the case that all tribes with this pristine organisation possess identical ceremonies and ideas.
Propinquity,This directed the attention of the Committee to the effect on morality of the propinquity of the sexes in schools.
Propinquity,There is no influence so little regarded for the young by those in authority as the tremendous influence of propinquity.
Propinquity,propinquity tightens bonds and there is a steady blossoming of the character in a radiant atmosphere.
Propinquity,Of the perils of propinquity I have already spoken; the risks of contrast are also great.
Propinquity,And Japan would be able to enjoy the fruits of propinquity to her heart's content.
Quintessence,"That, America, is the quintessence of naturally occurring British-cute."
Quintessence,"The actor is the quintessence of smooth, first as Remington Steele, then James Bond."
Quintessence,"In recent years, Stoner entered a category of which it soon became the quintessence."
Quintessence,"Yes, Holmes was the quintessence of the Victorian rationalism, “the most perfect and reasoning machine that the world had seen.”"
Quintessence,"“Innocence is the quintessence of the snapshot,” Lisette Model would write."
Quintessence,"Preserve this precious quintessence of mercury, which is exceedingly volatile, in a well-closed vessel for further use."
Quintessence,"This drama is the quintessence of all that Gorky has, up to this time, written on the ""ex-man,"" whom he has thoroughly ""explored."""
Quintessence,"Only as a subscriber, possessing a numbered set of a limited edition, could one obtain the quintessence of literature."
Quintessence,"They are the quaint quintessence of conservatism, and will occupy youthful minds menaced by modernism."
Quintessence,"Ten beds, and only one occupied, by a freckled, tousled quintessence of fractiousness in a blue wrapper."
Rainbow,"Meanwhile, big dollar advertising campaigns have taken an explicit rainbow-hued slant."
Rainbow,"She is smiling, a pink-striped hat on her head and a mini rainbow lollipop sticking out of her mouth."
Rainbow,"Here and there, sparingly, one of the dolls might be purple or green: “rainbow Piets,” they call them."
Rainbow,"David Bowie, Ronnie Wood, and Marianne Faithfull were regulars at the rainbow Room, a restaurant on the fifth floor."
Rainbow,Because the marketing of the screening included a rainbow flag and said it was to be the kickoff of “LGBT Awareness Month.”
Rainbow,Directly after them came a lot of palace attendants in curious hats and long robes of all colours of the rainbow.
Rainbow,"The colours of the rainbow shone there in pale tints, and the flaring sunshine could not enter."
Rainbow,They glittered and shone with an intensity of colour which surpassed even those of the rainbow.
Rainbow,"Nor did the future appear any more in a rainbow glory, since he realised that it would bring renunciation as well as joy."
Rainbow,As the appearance of the rainbow when it is in a cloud on a rainy day: this was the appearance of the brightness round about.
Ripple,Analysts interpreted it as an immediate ripple effect of the newly established US-Cuban détente.
Ripple,And sending Cary to prison has a ripple effect for all of these characters.
Ripple,"Playing in her yard one day, she saw “a ripple, a disturbance of the air … My first thought is that I have seen the devil.”"
Ripple,The heat creates mirages with waves that ripple through the air.
Ripple,There was a ripple of assent in the crowd as the word spread.
Ripple,"This was said with a comical air of doubt, and a half smile, which sent a ripple of laughter over the charming face."
Ripple,All was silent; a fresh breeze swept over the clear lake whose every ripple had the gracious curve of a smile.
Ripple,"He thought he heard the ripple of waves on a sunlit shore, and of wide-spreading trees which grew close to the edge of the sea."
Ripple,"Suddenly it ceased raining; and, looking about them, they saw that the lake was perfectly quiet—not a ripple could be seen."
Ripple,You see that there the ocean tides and the currents of the river meet and cause a constant ripple.
Sanguine,The experience left them sanguine about the sometimes vitriolic opinions of strangers on the Internet.
Sanguine,"She is equally desirous of Levine, as animalistic and eager to consume him while sticky with sanguine fluid."
Sanguine,"That said, I am not as sanguine about the future of the U.S.-Egypt bilateral relationship."
Sanguine,"These days, seven years after his book was published, Thomas is a bit more sanguine about his early life."
Sanguine,A senior government minister in Kabul is more sanguine about the possibility of eventually restarting peace talks.
Sanguine,I leave Italy with a less sanguine hope of her speedy liberation than I brought into it.
Sanguine,But I feel sanguine in the spirit of the men; sanguine in my own spirit; sanguine in the soundness of my scheme.
Sanguine,"Parliament is often more easily persuaded than the shrewd investor, as many a too sanguine promoter knows."
Sanguine,This fearful war was a deathblow to your father's sanguine hopes of making a rapid fortune.
Sanguine,"I really believe that is a good story, Jess, said her mother, who was sanguine of temperament."
Scintilla,That had more than a scintilla of substance—is Mitt actually a political shape-shifter?
Scintilla,How could anyone do all this without leaving behind a scintilla of microscopic evidence?
Scintilla,Forde is among those who note that every scintilla of blame cannot be put on FitzPatrick and Drumm.
Scintilla,It does take a certain talent to take Paul Newman and present the actor without a scintilla of excitement.
Scintilla,I have not a scintilla of interest in being at court when the judge sentences him.
Scintilla,"I would not, Mr. President, give up a scintilla of that portion of the responsibility which the crisis imposes on me."
Scintilla,They had merely waited that scintilla of ocular confirmation of a known danger.
Scintilla,This seems to me to have not a scintilla of justice about it.
Scintilla,"In these churches there were no fire altars; but the small scintilla of sacred fire preserved in them, was kept only in a lamp."
Scintilla,"She is beautiful of course, but quite without charm or the slightest scintilla of wit."
Serendipity,Then came one of those weird bits of serendipity that make the writing life—and the book tour—worth all the trouble.
Serendipity,I was thinking of new ways to engage with my audience and with a bit of serendipity and inspiration the cake was born.
Serendipity,"I often think about the fall lines of life, the invisible tightropes that divide moments of calamity and serendipity."
Serendipity,"More often than not, turncoat spies are successfully recruited as one-offs, through serendipity and dumb luck."
Serendipity,"It strips music buying of serendipity and context, making Justin Bieber as important as the Beatles."
Serendipity,"It was just six o'clock, and the public-house opposite the serendipity shop was lighting up."
Serendipity,"serendipity, sėr-en-dip′i-ti, n. a love for rare old books and other articles of virtu."
Serendipity,That polite trifler is fond of a word which he coined himself—'serendipity.'
Serendipity,"It is more than this: it is a matter of observation to any one with a moderate degree of ""serendipity."""
Serendipity,"They think of serendipity as earned, of work as bestowed, of success as deserved and reserved to the deserving."
Sibilant,"But she only lifted a warning finger and made a sibilant sound with her lips, adjuring silence."
Sibilant,"Exemplify the sibilant impurity with such syllables as pish, false, traitress, miscreant."
Sibilant,But out of the muck-heap I picked five pearls—four sibilant nouns and a name that I knew before.
Sibilant,"Grace whispered, but the sibilant swish of sounds seemed more resonant than an outspoken address might have."
Sibilant,"The tones were first high, then low, never guttural, and possessed a certain sibilant quality."
Silhouette,"The coat, with fitted bodice, nipped-in waist, and full skirt, created a familiar silhouette for Kate."
Silhouette,I would have added “no photographs of meditative politicians walking on the shore” with a slash though a silhouette of JFK.
Silhouette,"As you walk in front of the first screen, your silhouette appears and birds swoop down toward you."
Silhouette,"And I sat there as he shot the silhouette, but he had to stop because I started frantically crying."
Silhouette,"She picks out Diane von Furstenberg dresses and starts really enjoying this new silhouette, this new freedom."
Silhouette,In the dimly-lighted doorway of a corner house the figure of a Chinaman showed as a motionless silhouette.
Silhouette,"It was then easy enough to obtain a fairly accurate silhouette, by either outlining the profile or cutting it out from the screen."
Silhouette,"He existed, moreover, only in contour; he never rose above harmoniously outlined silhouette."
Silhouette,"Pete produced the silhouette of a young lady, and handed it round."
Silhouette,"Looking in the same direction I saw, through the haze, the sharp outlines of a city in gray silhouette."
Solitude,Perhaps some of that solitude and bitterness found its way into Alec Leamas.
Solitude,The Dude is at his happiest when he has a few minutes of solitude and rest to get high and listen to whale sounds.
Solitude,"solitude activates the imagination, and invites introspection."
Solitude,"Adam (Tom Hiddleston), the vampire composer, seeks solitude and people willing to trade him his blood fix."
Solitude,"If you thought qualifications for being a hermit were a tendency toward solitude and dislike of civilization, think again."
